recommendation,use,authors,title,year_publication,journal,country,study_design,aim,relation_to_research,typ_ds,type_of_dms,ICD,medical_condition,patient_preferences_incorp,assesment,assess_patient_preferences,description_patient_pref,type,type spec,tools_techniques_frameworks,involv,patient_involvement,,stakeholders_involved,a,design_reatement_options,evaluate_balance_quantify,findings_related_ebq,ua,user_acceptance_tested,outcomes,limitations,implications_future,benefits,
1,1,Eckman et al.,Developing an Atrial Fibrillation Guideline Support Tool (AFGuST) for Shared Decision Making,2016,Current medical research and opinion,USA,Research Article,evelopment of an Atrial Fibrillation Guideline Support  Tool  (AFGuST) to assist the process of integrating patients' preferences into this decision,Development of a tool to assist incorporating patient preferences into decisions ,2,guideline support tool,11,Atrial fibrillation,individual risk of stroke and major bleeding; and their risk of intracerebral hemorrhage ,specific,personalized utility assessment; standard gamble technique, utilized a Markov decision analytic model to integrate patient-specific risk for stroke and hemorrhage and individual patient values for relevant outcomes,s,mar,Markov decision analytic model,tool,Personalized Utility Assessment,2,patients and clinicians,,presented two treatment options to patients in a personalized pamphlet that included a decision analytic model, -, -,1,yes,develop a patient-tailored decision-support tool;incorporate individual patient's stroke and bleeding risks and their values for major bleeding events and stroke to facilitate a shared decision-making process; evaluate the impact of the AFGuST on the decision-making process and various measures of decision quality through a cluster-randomized clinical trial;," current risk prediction models do not incorporate all potentially significant risk factors; using warfarin as a conservative proxy for all oral anticoagulant therapy instead of novel oral anticoagulant agents;need to develop, refine, test, and use tools such as the tool in clinical settings; pilot testing and planned cluster-randomized clinical trial are not yet completed","ompletion of the planned cluster-randomized clinical trial to evaluate the impact of the tool; integrating decision support tools like the AFGuST into comprehensive health information systems; conceptual model of patient-centered decision-making, as exemplified by the AFGuST, can be extended to other patient populations; ensure their effectiveness and operationalization for shared decision-making by ongoing development, testing and refinement","employed a patient-centered approach, involving an iterative design process that included clinicians and patient focus groups; allowing for a personalized assessment of patient values and preferences;  pilot testing of the AFGuST to evaluate its usability and understandability; ",,
1,1,"Montazerhodjat V, Chaudhuri SE, Sargent DJ, Lo AW",Use of Bayesian Decision Analysis to Minimize Harm in Patient-Centered Randomized Clinical Trials in Oncology,2017,JAMA Oncology ,USA,research article,"incorporate patient values and preferences into clinical trials in an objective, systematic, transparent, and repeatable manner using Bayesian decision analysis",se of Bayesian decision analysis (BDA) in patient-centered randomized clinical trials (RCTs) in oncology aims to systematically and objectively incorporate patient values and preferences into the trial design ,1,model,2, cancer therapeutics and patient-centered randomized clinical trials (RCTs) in oncology,general,-, -,"The proposed framework uses Bayesian decision analysis (BDA) to make the tradeoff between type 1 and type 2 errors, balancing the consequences of false-positive and false-negative errors on patients. The BDA model calculates the optimal values of alpha and power for randomized clinical trials (RCTs) that minimize the expected harm to patients, given the parameters relevant to any specific disease. Patient preferences are incorporated into the model by assigning weights to the outcomes of interest based on their relative importance to patients. This allows for a more patient-centered approach to clinical trial design.",m,bay,Bayesian decision analysis,-,"The study proposes a framework for incorporating patient preferences and the burden of disease into the design of clinical trials using Bayesian decision analysis. This framework involves defining criteria, weighting them based on patient preferences, and using decision analysis to determine the optimal sample size and allocation of patients to treatment arms. However, the study does not provide specific details on how patients were involved in the decision-making process.",3,"patients, caregivers, physicians, biopharma executives, regulators, and policymakers, to formulate explicit cost estimates for type 1 and type 2 errors.",, -, -, -,0, -,"The main outcomes of the study involve measuring the potential harm to patients under both null and alternative hypotheses using NCI and Alliance data, and then computing BDA-optimal type 1 error rates and sample sizes for oncology RCTs. The study computed BDA-optimal parameters for the 23 most common cancer sites using NCI data, and for the 10 Alliance clinical trials. The study concludes that Bayesian decision analysis is a systematic, objective, transparent, and repeatable process for deciding the outcomes of RCTs that explicitly incorporates burden of disease and patient preferences.", limited by the assumptions underlying the specific models used in the BDA framework; limited generalizability to other contexts or populations; practical application of the BDA method in real-world clinical settings may present challenges; not fully address the perspectives and input of all relevant stakeholders; limited in its consideration of adaptive trial designs, -,Minimizing harm to patients by incorporating their preferences and the burden of disease into the design of clinical trials; Balancing the risks and benefits of a treatment to ensure that both types of harm are accounted for when deciding whether a drug should be approved; Providing a quantitative framework where the risks of a treatment are balanced against its benefits; Allowing for the systematic weighing of multifaceted tradeoffs that reflect a variety of perspectives;  Flexibility and practicality of the Bayesian decision analysis framework,,
1,1,"Henshall C, Marzano L, Smith K, Attenburrow MJ, Puntis S, Zlodre J, Kelly K, Broome MR, Shaw S, Barrera A, Molodynski A, Reid A, Geddes JR, Cipriani A","A web-based clinical decision tool to support treatment decision-making in psychiatry: a pilot focus group study with clinicians, patients and carers",2017,BMC Psychiatry,UK,Research article,to assess the feasibility and acceptability of a web-based computerized clinical decision support tool (CDST) developed for use in psychiatry,Although the main aim of study is testing the acceptability not to describe development of it thet briefly talked about how does it works and it uses patient preferences,3,web-based computerised clinical decision support tool,6,psychiatric care,Yes about relevance of the possible side effects,skala,Questionnaire Slide bar from zero to 100,"CDST balances stratified recommendations from network meta-analysis with the preferences and values of patients, carers, and clinicians",s,net,network meta-analysis,s,scoring,2,"Yes , psychiatrists",,routine psychology drugs, -,the CDST balanced stratified recommendations from network meta-analysis (the best methodological design for comparative effectiveness) in combination with the preferences,1,Yes positive,"Researchers conclude that CDST can improve communication pathways between patients, carers and clinicians",patients varied substantially in how much they wish to contribute to the decision-making process ***the authors wrote this as a limitation but personally I think it is more like a finding***,To test simplified versions of decision aids and choose the most simple and efficient one  To conduct pilot randomized controlled trial to test the CDST,patients and carers placed value in the CDST's ability to facilitate discussion about the side-effect profiles of drugs,,
1,1,"Mor Peleg, Yuval Shahar, Silvana Quaglini, Adi Fux, Gema García-Sáez, Ayelet Goldstein, M. Elena Hernando, Denis Klimov, Iñaki Martínez-Sarriegui, Carlo Napolitano, Enea Parimbelli, Mercedes Rigla, Lucia Sacchi, Erez Shalom, Pnina Soffer",MobiGuide: a personalized and patient-centric decision-support system and its evaluation in the atrial fibrillation and gestational diabetes domains,2017,User Modeling and User-Adapted Interaction,Israel,Research Article,"To develop and evaluate the MobiGuide system, a patient-centered decision-support system (DSS) for atrial fibrillation (AF) and gestational diabetes mellitus (GDM)",The app has been discussed in the paper incorporates patient preferences,2,Decision aid,11,atrial fibrillation - gestational diabetes mellitus - (but also can be further developed for other areas),"Yes, Preferences about medication, monitoring schedules, meal times, and self-monitoring",q,questionnaire,Not explained explicitly. Authors just told Preferences were incorporated into clinical guidelines using decision trees to increase patients utility,d,d,decision trees,s,scoring,2,"Yes, clinicians",,"For AF: 1- Warfarin 2- Dabigatran and other options regarding scheduling, Medication Management and lifestyle management GDM: insulin therapy, diet and blood glucose monitoring frequencies ", -, -,1,"Yes, Positive","High patient satisfaction, increased sense of safety, sustainable usage by patients and clinicians","Small sample size, limited to two clinical domains",Further research is needed to test the system in other clinical domains and with larger patient populations,Improved patient engagement and personalized care,,
1,1,"Juan Fdez-Olivares, Eva Onaindia, Luis Castillo, Jaume Jordán, Juan Cózar ",Personalized conciliation of clinical guidelines for comorbid patients through multi-agent planning,2018,"Elsevier, Artificial Intelligence In Medicine",Spain,Article ,to propose a MAP (Multi-agent planning) framework for automated conciliation of clinical guidelines with patient-centred preferences ,through the MAP architecture patient preferences are incorporated and accommodated along with clinical practice guidelines (CIGs) for patients with comorbid conditions,3,shared decision making using Multi-agent planning  (MAP) framework ,8,MAP approach is tested on case study for Diabetes Mellitus and Arterial Hypertension," -qualitative preferences: personal factors, desires and preferences that determine the patient habits and lifestyle  eg. oral vs injectable medication.... -quantitative preferences: measurable terms that are used to determine the patient perception over a treatment  → priority of a patient for a plan or treatment ","i,q", -qualitative preferences: elicited by the physician through an ordinary conversation -quantitative preferences: elicited through a simple and comprehensive questionnaire that enables patients to respond quesions about a given treatment , -qualitative preferences used to guide selection of decision procedures within each clinical practice guidelines (CIGs)  -quantitative preferences were used in a Multi-Criteria Decision Making (MCDM) process to select the most adequate treatment plan,m,mcda,MAP (Multi-Agent Planning is used to incorporate patient preferences into the treatment planning process → MAP is an artificial intelligence framework ,"q,i",talk to physicians & fill out questionnaire,2,patients & physicians ,,/,quantitative prefences given by patients in qualitative scale were automatically converted to a numeric rating scale  -> each preferences maped to a qualitative score ,/,0,experimental validation to analyse the entire life of the architecture,Model was developed for personalized conciliation of clinical guidelines for comorbid patients incorporating patient preferences , -need to adapt to deviations like the evolving patient conditions or the high dynamism and unpredictability of the clinical environment  -lacks features for plan execution and computer-physician interaction during the planning process -requires significant knowledge engineering efforts ,exploit the MAP step-wise process to give support to shared decision making → the architecture should be regarded as a core technology to provide support to both clinicians and patients when making decisons before enactment of the conciliated plan,provides a structured approach to handling comorbidities and patient preferences  -advantages of MAP architecture  →Flexibility: more flexible interaction solving process →Distributed knowledge representation →Potentially scalable : the encapsulation of knowledge in each agent leads to a loosely-coupled architecture that opens the way to a scalable management of new diseases,,
1,1,Lindhiem et al.,Development and Preliminary Feasibility Testing of a Decision  Support Tool for Childhood Anxiety Treatment,2018,Cogn Behav Pract,USA,research article,develop and test the feasibility of a decision support tool for childhood anxiety treatment,outlines the development and feasibility testing of a decision support tool that integrates patient preferences,3,DSS,6,childhood anxiety,general,"i,q",interview,"The tool uses a decision support system (DSS) to integrate patient values and preferences into the PTB method, allowing for a systematic way to arrive at a personalized treatment recommendation. The DSS enables child and parent preferences to be explicitly stated and facilitates discussions about how best to incorporate their preferences into an evidence-based treatment strategy. The models described in the paper were created using the GeNIe Modeler, available free of charge for academic research and teaching use from BayesFusion, LLC.",m,e,PTB method,tool,"The tool integrates data on baseline symptom severity, the relative effectiveness of two or more treatment options, and patient preferences and values to arrive at a personalized treatment recommendation.",2,patients and parants and healthcare providers,,"Probability of Treatment Benefit (PTB) method has been proposed as a decision support tool for therapists to assist patients in choosing between two or more efficacious treatment options. Additionally, the Decision Support System (DSS) displays the recommended treatment based on the preferences of parents and children.", -, -,1,"Yes, with preliminary test on usability and satisfaction. positive results","patients who were given a treatment choice or received a preferred treatment reported higher satisfaction, were less likely to drop out of treatment, and had better clinical outcomes compared to patients who received a less preferred treatment",small number of pilot participants; ack of follow-up throughout treatmen,"focus on testing the use of the decision support tool in larger samples of treatment-seeking families and in community settings to determine its effectiveness in reducing treatment drop-out and enhancing clinical outcomes. Additionally, there is a need to transport this approach to real-world settings to reduce the science to practice gap in mental health treatment.","usability and utility of the decision support tool to guide treatment selection for childhood anxiety, the ability to balance the best medical knowledge available with patient values, and the potential for improved quality of treatment and shared decision making between patients and providers.",,
1,1,"Eckman MH, Costea A, Attari M, Munjal J, Wise RE, Knochelmann C, Flaherty ML, Baker P, Ireton R, Harnett BM, Leonard AC, Steen D, Rose A, Kues J",Shared decision-making tool for thromboprophylaxis in atrial fibrillation - A feasibility study,2018,American Heart Journal,USA,Research Article,To evaluate the feasibility and effectiveness of a shared decision-making tool in improving various measures of decision-making,They describes how their tool is working and it actually incorporates patient preferences,2,decision Aid,11,Thromboprophylaxis in patients with atrial fibrillation,"Yes, about utilities of possible outcomes of each treatment regimen",specific,standard gamble technique,"patients weigh the risk of the worst outcome (death) against the certainty of living with the condition under consideration with using a app named the ""Gambler""",s,mar,29-state Markov state transition model,s,Scoring ,1,No,,"1) no antithrombotic therapy, 2) aspirin, 3) warfarin, 4) dabigatran, 5) apixaban, 6) rivaroxaban, and 7) edoxaban",quality-adjusted life years ,The model does not recommend a change in treatment unless there is a minimum gain of 0.1 QALYs compared with current treatment. As there was some uncertainty which cannot calculated by the model,1,"Yes, Positive","enhanced shared decision-making, improved patient engagement",The study's generalizability might be limited due to its setting in a specialized clinic and involvement of highly engaged clinicians,They suggested that further studies should be conducted to explore the tool's application in broader clinical settings and its long-term impact on clinical outcomes,"Improved decision-making quality, increased patient satisfaction, better adherence to medication, and enhanced patient knowledge regarding atrial fibrillation and its treatment.",,
1,1,Choi et al.,"Personalizing Second-Line Type 2 Diabetes Treatment Selection: Combining Network Meta-analysis, Individualized Risk, and Patient Preferences for Unified Decision Support",2019,Medical decision making,UK,Research Article,"tegrate meta-analytic treatment effect estimates with  individualized risk calculations and preferences, to aid personalized treatment selection","integrated patient preferences, disease outcomes, and medication  efficacy and safety profiles into a decision modeling  framework for the selection of second-line glycemic therapy",3,DSS,5,type 2 diabetes,"whether the treatment was parenteral or oral, degree of average body weight gain or loss, change in HbA1c, medication cost, and recommended times per week for glucose self-monitoring",specific,weighting,"tandardizing these three factors into 0 to  1 scales, and the multiplying, we calculated the ranking score for each medication",m,mcda,"Multi-Criteria Decision Analysis, ",w,Patients can assign weights to different decision criteria based on their preferences,2,Patients; Healthcare Providers,,"treatment options and their corresponding ranking scores may be presented to the patient in a visual format, such as a decision matrix or chart. This visual representation allows the patient to see how different treatments compare in terms of efficacy, safety, and alignment with their preferences.",Normalization; Sensitivity analysis,"Normalization allowed for a standardized representation of patient values across various treatment attributes; Sensitivity analysis demonstrated the flexibility of the decision support tool in accommodating variations in patient priorities and preferences, allowing for the exploration of different scenarios and their effects on treatment selection",0, -,"developed a unified treatment decision support tool that integrates patient preferences, disease outcomes, and medication efficacy and safety profiles; employed a Multi-Criteria Decision Analysis approach to calculate ranking scores for each medication;  integrated data from network meta-analysis of randomized trials, validated risk equations for type 2 diabetes complications, and patient preferences around treatment; modeling approach led to wide variations in the selection of different second-line treatments","modeling approach relies on secondary data sources; Extrapolating data from follow-up periods to longer time periods may introduce uncertainty in the long-term effectiveness and safety assessments; tool's recommendations may need to be adjusted based on local cost considerations and healthcare system characteristics; proportional relative risk reductions in cardiovascular outcomes based on baseline risk may affect the mode's prediciton; Need for Further Validation and Testing; potential for heterogeneity across included studies and the assumption of similar participant characteristics across treatment groups in NMA; not account for non-quantifiable factors, such as ethical considerations or social determinants of health","refining and validating the decision support tool; include long-term follow-up studies to assess the sustained effectiveness and safety of different second-line diabetes treatments; onducted to validate the risk equations used in the decision support tool for estimating individualized risk for type 2 diabetes complications; explore the integration of cost-effectiveness analysis into the decision support tool; investigate the inclusion of additional decision criteria, such as patient-reported outcomes, quality of life measures, and treatment adherence factors; developing and testing strategies to enhance patient engagement; generalized to other clinical scenarios;",personalized approach to selecting second-line glycemic therapy for type 2 diabetes;  provides a comprehensive decision-making framework that considers multiple factors influencing treatment selection; approach allows for objective quantitative comparisons across all available treatment options; can be generalized to other treatment decisions; transparency due to open source publication,,
1,1,Li et al.,A Bayesian approach for individual-level drug benefit-risk assessment,2019, Statistics in medicine,USA,research article,proposed a Bayesian multicriteria  decision-making method for BRA of drugs using individual-level data.,applied the stochastic  multicriteria acceptability analysis approach for BRA incorporating imprecise and heterogeneous  patient preference informatio,1,model,24,medication,general,specific,"swing weighting method, where the clinician judged the relative importance of different criteria","patient preferences are represented as subject-specific weights vector, which are used to scale differences in probability or severity of benefits and risks to reflect their importance to patients",m,smcda,MCDA; SMAA; MLT-SMAA; ,w,swing weighting method enabled the involvement of patients in the decision-making process,2,clinicans and patients ,, -,swing weighting method was employed to elicit weights,"method allowed for the structured assessment of the relative importance of different criteria to patients, enabling the quantification of these preferences within the benefit-risk assessment model",0,-,Development of a Bayesian multicriteria decision-making method for individual-level drug benefit-risk assessment; Utilization of a multidimensional latent trait model to account for the heterogeneity of treatment effects and dependencies among outcomes; Application of the stochastic multicriteria acceptability analysis approach for benefit-risk assessment; Implementation of an efficient Markov chain Monte Carlo algorithm to execute the proposed method,"Reliance on a single trial for evaluating comparative benefit-risk profiles; Demonstration of the method using data at the primary endpoint, without considering potential changes in benefit-risk trade-offs over the course of long-term trials; Simplification of the model by using two latent variables to represent efficacy and safety states; need for further investigation into determining the optimal number of latent variables; Computational challenges that may arise with a larger number of latent variables;  study on creatine was not specifically designed to assess benefit-risk balance","Incorporating meta-analytical approaches to account for evidence from multiple trials and post-market studies; Extending the proposed method to incorporate longitudinal outcomes; Exploring more sophisticated models to determine the number of latent variables; Addressing computational challenges associated with a larger number of latent variables through methods such as variational Bayesian inference or other approximations; exploring alternative methods for eliciting patient preferences, such as discrete choice experiments",Enhanced accuracy and precision in estimating and predicting the benefit-risk balance; Improved understanding of the association between benefits and risks of a drug; Identification of subgroups of patients who are most likely to benefit from a product and are willing to accept the associated risks; Consideration of individual differences in drug benefit-risk assessment; More robust and transparent methodologies for determining whether a drug's potential benefits outweigh its risks; ,,
1,1,Robert A. Sowah Adelaide A. Bampoe-Addo Stephen K. Armoo Firibu K. Saalia Francis Gatsi Baffour Sarkodie-Mensah,Design and Development of Diabetes Management System Using Machine Learning,2020,International Journal of Telemedicine and Applications,Ghana,Research Article,to improve the management of diabetes through a software system,In the meal recommendation module the software incorporates patients meal preferences,2,Decision Aid ,5,Diabetes management,"Yes, Regarding diet type and previous meal selection",q,Direct questions in the software,The app first chooses five best meals based on  K-nearest  neighbour of patients nutritional requirements then orders them based on Euclidean  similarity score ,s,s,They used K-Nearest Neighbor algorithm for meal recommendations,s,scoring,1,No,,Different meals and meal types , -, -,0,No,The system effectively integrated several components to assist diabetes management, -,expanding machine learning algorithms.,"The system offers a modern approach to diabetes management by integrating AI technologies, potentially improving patient outcomes and self-management capabilities.",,
