recommendation,use,authors,title,year_publication,journal,country,study_design,aim,relation_to_research,typ_ds,type_of_dms,ICD,medical_condition,patient_preferences_incorp,assesment,assess_patient_preferences,description_patient_pref,type,type spec,tools_techniques_frameworks,involv,patient_involvement,,stakeholders_involved,a,design_reatement_options,evaluate_balance_quantify,findings_related_ebq,ua,user_acceptance_tested,outcomes,limitations,implications_future,benefits,
1,1,Simes RJ,Application of statistical decision theory to treatment choices: implications for the design and analysis of clinical trials,1986, Statistics in Medicine,Australia,Research Article,Aim of the studyTo explore the application of statistical decision theory to treatment choice sin cancer,The article compares two methods of utility assessment for decision analysis which both incorporated patient preferences  ,1,decision analysis,2,ovarian cancer,"Yes, about utility of health situations ",specific,1-For for symptom-free survival: 'standard gamble' and certainty equivalence method 2- quality of life in various states of health: time trade-off method,"With utility analysis, where utilities represented the patient's preferences for different health outcomes",d,d,Decision tree,s,scoring,2,"Yes, preferences of medical doctors were also elicited",,1-treatment with an alkylating agent 2- treatment with combination of alkylating agent  and chemotherapy  3-no specific anti-cancer therapy,threshold utility analysis,"As well as decision analysis, in this paper author conducted a threshold utility analysis and found that two methods results were in line with each other.",0,No,The results showed the process of utility assessment can be greatly simplified by using  threshold utility analysis,small numbers of selected individuals,larger studies should be conducted,decision theory enables key factors in the decision to be identified. In this way research  efforts aimed at improving the clinical decision can be focused on those areas,
1,1,"Douzdjian V, Ferrara D, Silvestri G",Treatment Strategies for Insulin-Dependent Diabetics With ESRD: A Cost-Effectiveness Decision Analysis Model,1998,American Journal of Kidney Diseases,USA,Research article,to conduct a clinical decision analysis focused on patients with type I diabetes and end-stage renal disease (ESRD,They incorporated patient preferences in the the decision analysis,1,decision analysis model,16,end-stage renal disease (ESRD),yes,i,Direct Interviews ,They first asked patients if they would accept the surgery option if the risk of death from the operation or from complications was 5%. This risk was increased until the patient was indifferent between surgery and dialysis. Then they used the accepted risk in a formula to calculate utility. At the end they calculated expected cost per quality-adjusted year.,d,d,They used cost per quality-adjusted year as the measure of outcome (decision tree),w,weighting,3,"Patients, healthcare providers and institutions",,dialysis kidney-alone transplant from a cadaver (KA-CAD)  kidney-alone transplant from a living donor (KA-LD) simultaneous pancreas kidney (SPK) transplant,Standard Reference Gamble method,After quantifying patient preferences they noticed there is huge heterogeneity between answers ,0,No,"SPK transplantation remained the optimal strategy after varying survival probabilities, costs, and utilities over plausible ranges by means of one-way sensitivity analysis",-reported cost figures usually represent charges rather than true costs - patients who had already experienced the outcome states studied -varying degrees of severity in diabetic complications -Standard Reference Gamble method assumes that a patient's attitudes towards outcomes and length of life remain constant,"-Conducting prospective studies - Longitudinal studies tracking patients over an extended period  -prioritize patient-centered outcomes research -Utilizing advanced analytical methods, such as simulation modeling or machine learning, to analyze complex decision scenarios", -,
1,1,"Montgomery AA, Harding J and Fahey T",Shared decision making in hypertension: the impact of patient preferences on treatment choice,2001,Family Practice,UK,Research Article,to investigate the impact of patient preferences on treatment recommendations for hypertension using individual decision analysis,It uses patient preferences to investigate if it differs the treatment suggestion which could be given from existing guidelines,1,decision analysis,11,hypertension,face to face interviews,q,"The health states (outcomes) from the decision tree were described in bullet-point format on laminated cards, and the patient was asked to rank them in order of preference",standard gamble method,d,d,Ranking utility of possible outcomes (decision tree),sur,scoring,1,patient,,treatment' and 'no treatment',Standard Reference Gamble method,By incorporating patient preferences in decision analyses suggested treatment has changed for nearly half of the patients,0,No,Individual patient preferences have a substantial impact on the proportion of patients for whom drug treatment would be recommended.,"1-Over one-third of patients invited were either unwilling or unable to participate, and of those who attended 19% were unable to complete the utility assessment interview. (This response rate indicates that this type of decision aid may not be suitable for all patient groups_) 2- a balance must be achieved between a full decision tree containing all possible outcomes and keeping manageable the number of health states that the patient must assess 3-it is not possible to exclude interviewer bias as interviews are done by 2 researchers 4- study constraints allowed only collection of repeat prescription data as a measure of medication adherence","To test if using a utility assessment software which requiring minimal input from researchers, removes bias effects of researchers.", -,
1,1,"Knight SJ, Nathan DP, Siston AK, Kattan MW, Elstein AS, Collela KM, Wolf MS, Slimack NS, Bennett CL, Golub RM",Pilot study of a utilities-based treatment decision intervention for prostate cancer patients,2002,Clinical Practice Guidelines,USA,Research Article,to evaluate a shared decision-making approach to in the context of localized prostate cancer care.,Their model uses patient preferences as one of major components,1,decision analytic model,2,prostate cancer,"Yes, about utilities of for various possible prostate cancer-related  health states, including impotence, incontinence, watchful waiting, combined incontinence and impotence",specific,standard gamble technique in interview,"First Patients were asked to imagine various health states and make choices between different treatment options based on their preferences. Then these utilities along with possible complications (e.g., incontinence, impotence) were used to calculate QALEs",s,mar,Markov model,w,weighting,2,"Yes, urologist",,"surgery,  radiation therapy  watchful waiting",quality-adjusted life expectancies (QALEs),1-The researchers find Inconsistent  utilities: the development of combined sexual and bladder  dysfunction had a better utility than the development of either dysfunction alone! 2- the results of model was inconsistent with the doctor's  recommendations for half of patients,"1,-1","Yes,( from perspective of doctor) negative",They understood Future refinements of both the utility assessment  exercise and decision analytic model may be needed before the feasibility of the model in the clinical setting can be determined,1-the decision analytic model did not consider several widely used treatments for simplicity reasons. 2-the probabilities for the progression of disease and the probabilities for complication rates associated with treatments were based on a literature review published in 1993 (very old),1-Future research is needed to evaluate a decision analytic model that incorporates these recent data 2-Further research is needed to understand best utilities assessment method (using prompts versus using a nondirective approach), -,
1,1,"I Pell, J Dowie, A Clarke, A Kennedy, V Bhavnani",Development and preliminary evaluation of a clinical guidance programme for the decision about prophylactic oophorectomy in women undergoing a hysterectomy,2002,Qual Saf Health Care ,UK,Original article,to develop and evaluate a decision analysis based and computerised clinical guidance programme (CGP) that provides patient specific help on prophylactic oophorectomy to reduce risk of ovarian cancer,patient preferences are integrated into Markov models to provide personalized results ,2,Computerised clinical guidance programme,2,Ovarian cancer ,"risk tolerance, health state evaluations using standard ""time trade off"" method → ""women asked to say how many years of normal health she would be prepared to give up in oder to be free of a particular combination of factors affecting her health suuch as reduced mobility and moderate pain""",s,"direct elicitation, population surveys ",preferences (risk factors & health state valuations) incorporated in Markov models that evaluated the benefits of undergoing prophylactic oophorectomy ,s,mar,Markov models integrated into Decision analytical framework   ,,"preferences elicitation, preliminary testing & piloting ",2,"Gynecologists, patients ",,prophylactic oophorectomy,/,/,1,preliminary testing and preliminary piloting,Development of a model (CGP) that employs decision analytic techniques to model the consequences of undertaking prophylactic oophorectomy or not during a total abdominal hysterectomy ,"CGP reported does not incorporate costs -'the Model (CGP) is unusual in giving a very explicit guidance statement and this appeared to be problematic, especially for women who received advice that was discrepant with their previously held intentions""", -unterstand better the optimal timing for decision aids such as the CGP so that they can be used to their fullest potential as a readily available third option  -development of a more user friendly interface,Advantage of the data structure used in the CGP is that it can easily be updated to reflect new research findings → programme is dynamic rather than static,
1,1,"Thomson R, Robinson A, Greenaway J, Lowe P; DARTS Team",Development and description of a decision analysis based decision support tool for stroke prevention in atrial fibrillation,2002,Quality & Safety in Health Care,UK,Research Article,"To develop a computerized decision support tool, building upon a previous decision analysis, which would engage individual patient preferences in reaching a shared decision on whether to take warfarin to prevent stroke",This research explains how they developed a computerized decision support tool and explains how they incorporated patient preferences,2,prototype Decision aid,11,atrial fibrillation,"How they see burden of each of these: mild stroke, severe stroke, stomach bleed, and treatment with warfarin",sg,Standard gamble exercises,By asking patients series of four hypothetical questions and using an iterative procedure to reach the point of indifference. ,s,e,"Several methods were piloted including bar charts, pie charts, ""smiley faces"", and non-representational proportionate figure",w,weighting,3,"Yes, medical experts interviewed in different stages of development",,treat or do not treat with Warfarin,Markov decision analysis,Markov decision analysis done for finding optimal treatment choice with considering Risk factors for each patient and their preferences with,1,yes,"it showed that it is feasible to take elderly patients  through a computerized decision support tool, but it requires  time and expertise to use.", -,"1-To do an efficacy study to assess whether the tool can work in ideal circumstances 2-Look into if tensions exist between individually informed treatment decisions and, public health or health service goals 3- to explore why the decisions patients actually make will not necessarily concur with the ""optimal"" decision yielded by the model",decision conflict appeared to be reduced between both patients and GP,
1,1,Sommers et al.,Decision Analysis Using Individual Patient Preferences to Determine Optimal Treatment for Localized Prostate Cancer,2007,merican Cancer Society,USA,research article,aimed to determine the optimal treatment for localized prostate cancer based on individual patient preferences,"demonstrates a balanced and quantified method of incorporating patient preferences into the decision-making process, providing personalized treatment recommendations based on both clinical features and individual preferences",1,model,2,prostate cancer,"Gleason score, PSA, self-reported health, and the presence of ED, urinary incontinence, and/or bowel discomfort, anxiety under watchful waiting and variations in disease progression, side effects, discount rate, surgical mortality, and short-term treatment disutility in sensitivity analyses","s,i",surveys and interviews,"The study presented a decision model for localized prostate cancer that incorporated the range of preferences among a sample of men recently diagnosed with the disease. The algorithm used a survey to gather information on patient preferences and incorporated them into the decision-making process. The model focused on individualized patient preferences rather than using a hypothetical ""average patient"" concept. The objective was to determine the clinical scenarios for which variations in patient preferences lead to different optimal treatments and those for which the patient&apos;s clinical features alone are sufficient to dictate the optimal treatment. The study found that the optimal treatment often depends on individual patient preferences, not merely the clinical scenario. Tradeoffs between quantity and quality of life, as well as among different side effects, often determine which treatment would be optimal for a specific patient.",s,mar,markov model,q,"the patient was involved in the decision-making process through a survey that was conducted to determine their preferences. The survey included questions on the patient&apos;s age, prostate-specific antigen (PSA), and tumor grade, as well as their preferences for different treatment options and the importance they placed on various treatment outcomes. The responses from the survey were then used to develop a decision model that took into account the individual patient&apos;s preferences when determining the optimal treatment. The model also considered the patient&apos;s clinical features, such as age, PSA, and tumor grade, to ensure that the treatment recommendation was appropriate for their specific situation.",2,"clinicians, including urologists and radiation oncologists, as well as patients",,"The decision model presented in the study compared four treatments for localized prostate cancer: radical prostatectomy (RP), external beam radiation (EB), brachytherapy (BT), and watchful waiting (WW). The study analyzed the potential appropriateness of each treatment option for a particular clinical scenario based on individual patient preferences.",survey of 156 men with prostate cancer to elicit their preferences in quality-adjusted life years (QALYs) for different health states related to disease and side effects; lity function to quantify the impact of different health states and side effects on quality-adjusted life years," patient preferences were critical in determining treatment for low-risk cancers (Gleason score ≤6, PSA ≤10 ng/mL) and for patients aged 75 years and older;  30% of the patients in the sample had a different optimal treatment than the average patient when using average preferences; ",0,no,"optimal treatment for localized prostate cancer often depends on individual patient preferences;  findings indicated that using average preferences led to suboptimal therapy for 30% of the patients in the sample, resulting in a significant loss of quality-adjusted life expectancy; emphasized that tradeoffs between quantity and quality of life, as well as among different side effects; treatment decisions for patients with localized prostate cancer should be crafted in response to individual preferences","limited set of clinical scenarios, specifically age, prostate-specific antigen (PSA), and tumor grade; does not consider combination therapies; does not include obstructive/irritative urinary symptoms after radiation; study sample consists of men recently diagnosed with localized prostate cancer; does not explicitly address user acceptance testing or outcomes related to the acceptance","validating the findings of the study in diverse patient populations and clinical settings; explore the incorporation of additional clinical factors, such as comorbidities, disease progression, and treatment history; include user acceptance testing and implementation studies; evaluate the long-term outcomes of treatment decisions; comparative effectiveness analyses to compare the outcomes of treatment decisions based on individual patient preferences with those based on traditional decision-making approaches; explore the integration of patient decision aids or support tools that facilitate the incorporation of individual patient preferences into the treatment decision-making process","allow for personalized treatment decisions based on individual patient preferences; facilitate the decision-making process for patients facing difficult treatment choices;  allow for the consideration of tradeoffs between quantity and quality of life, as well as among different side effects, in determining the optimal treatment for a specific patient; emphasizes the potential benefits of using an impartial, evidence-based decision model ",
1,1,Nananda F. Col,Using Internet technologies to improve and simplify  counseling about menopause: The WISDOM website,2007,Maturitas,USA,Research Article,To introduce a web based decision aid and showing its importance,"This is a very incomplete article. It doesn't describe how the aid works thoroughly. However, this a article about a decision aid which incorporates patient preferences",2,Web based decision aid,16,menopause,"heart disease, stroke, blood clots, and breast cancer",specific,web-based decision support tool ,"model translates relative risks of treatment into absolute risks, and a database of menopausal treatments that are accessed via an interactive symptom/treatment chart that can be sorted by treatment type, symptom concerns, and efficacy",s,mar,embedded markov Model,-, -,1,No,,hormone therapy no hormone therapy,Multi-level explanations,This tool translates relative risks of treatment into absolute risks,1,"Yes, Positive","WISDOM was associated with patients feeling adequately informed, having as much input as they wanted in the decision, and feeling more confident in knowing their own risks",1-not all populations have Internet access so this limits usability of this decision aid 2-2- recruiting study participants for studies examining the impact of web-based interventions presents more hurdles because of consent and privacy protection, -,As this is a web based tool it can be updated easily with latest medical information,,no incorporation of patient preferences on individual level
1,1,"Clare L. Emnett, Alan A. Montgomery ",Decision-making about mode of delivery after previous caesarean section: development and piloting of two computer-based decision aids,2007,Health Expectations ,UK,Research paper ,to develop and pilot 2 computer-based DA's to assist women with decision making about delivery mode after previous caesarean section (CS),patient preferences (utility assessment exercise to rate various health outcomes) used to calculate an individualized recommendation for the most suitable mode of delivery  ,2,Computer based DA ,18,caesarean section," -Preferences regarding mode of delivery (VBAC, elictive CS, emergency CVS) -Preferences on how bad various health complications would be personally, if they occured to herself or her baby",skala,utility assessment  -graphical rating scale from 0-100,"decision analysis program:  individual recommendation for the mode of delivery calculated by summing the woman's utilities for the various possible health outcomes for each delivery method, weighted according to the estimated probabilities of those outcomes",a,e, sum of the woman's utilities for various possible health outcomes,s,patients rated health outcomes using a graphical rating scale to express their preferences ,2,Patients & Physicians,,VBAC or repeated elective CS,graphical rating scale from 0-100 to quantify preferences  ,/,1,pilot testing ,2 DA's were developed and were tested for user acceptance ,piloting session was only conducted with a small number of participants which means it was not feasible to employ a maximum variation sampling strategy to ensure the inclusion of women from a diverse range of socio-demographic backgrounds,need for a controlled randomized trial to evaluate the effectiveness and cost-effectiveness of the decision aids on a larger scale ,study reports the development and piloting work required to successfully create a new patient decision aid ,,
1,1,"Büyükdamgaci-Alogan G, Elele T, Hayran M, Erman M, Kiliçkap S",A decision-analytic model for early stage breast cancer: lumpectomy vs mastectomy,2008,journal Neoplasma ,Turkey,Research article,to construct a decision model that incorporated patient preferences over differing health state prospects,Their decision model incorporates patient preferences,1,Decision analysis model,2,Breast cancer,"Yes, about utility of each health situation",skala,Direct Rating Technique (rating from 0 to 100),"The utility of each health situation were elicited, then by multiplying it in expected years of life calculated by Markov model Quality Adjusted Life Years (QALY) is obtained",s,mar,QALY - Markov model,w,weighting,1,No,,lumpectomy  mastectomy,Multi Attribute Utility Model was developed and used for evaluation of extracted utilities,"MAUM results matched global ratings for six health states but not for the other six. The analysis found high correlation between MAUM and global ratings, especially for health states with no evidence of disease. However, as health states worsened, consistency of results decreased",0,No,"The results showed that, if the subject had mastectomy, mean value for the quality adjusted life years gained was 6.42; on the other hand, if the preference was lumpectomy, it was 7.00 out of a possible 10 years.","1-In this study seven basic health states were designated. But in real life, there are many more health states 2-The study was conducted with a sample population of female university students so actual utilities rated by real cancer patient could be different ",Authors said further research about the  optimal modalities for promoting patients' participation in  medical decision making will be helpful to design   regulations about patients' rights,The results of study showed decision aid can be used in training physicians' judgment on the complexities of the  decision making and to improve chances of making a good treatment decision.,,
