recommendation,use,authors,title,year_publication,journal,country,study_design,aim,relation_to_research,typ_ds,type_of_dms,ICD,medical_condition,patient_preferences_incorp,assesment,assess_patient_preferences,description_patient_pref,type,type spec,tools_techniques_frameworks,involv,patient_involvement,,stakeholders_involved,a,design_reatement_options,evaluate_balance_quantify,findings_related_ebq,ua,user_acceptance_tested,outcomes,limitations,implications_future,benefits,
1,1,Smith et al.,A decision aid for intensity-modulated radiation-therapy plan selection in prostate cancer based on a prognostic Bayesian network and a Markov model,2009,Artificial Intelligence in Medicine,USA,research article,develop a decision aid that helps physicians select the best intensity-modulated radiation therapy plan for prostate cancer patients,decision aid,2,demonstrating a method that incorporates patient preferences into medical algorithms and models,2,prostate cancer,"urinary difficulty, bowel problems, and metastatic cancer",l,literature,"The algorithm uses a multiobjective optimization to generate a set of treatment plans that span the range of possible dose distributions. The Bayesian network provides probabilities for outcomes related to treatment of the tumor and for each of the outcomes related to normal tissue. The Markov model is used to incorporate patient preferences for outcomes and to determine the optimal treatment plan for a particular patient. The model is the first decision aid in IMRT to combine the major dosimetric parameters of a treatment plan with clinical results, physician experience, and patient preferences.",s,bay,Bayesian network,,"The method reported in the paper involves incorporating patient preferences into the decision-making process. The decision model intends to determine which of several RT treatment plans is preferable for a particular patient. The information available to choose between competing IMRT treatment plans includes clinical trials designed to provide outcome probabilities for a selected set of variables, retrospective studies which seek to determine variables predictive of treatment outcome, and information from experts in the field. Physicians have a comprehensive view of the entire disease process, including some appreciation of the likelihood of different outcomes for a patient.",2,"physicians, physicists, and dosimetrists, patients",,Markov model evaluated with a cohort simulation to rank treatment plans based on quality-adjusted life expectancy ,"literature, mcda for balancing", -,0,"no, but method was evaluated using cohort simulation approach","he model was able to accurately predict the expected outcomes of different treatment plans, including local tumor control, regional spread, distant metastases, and normal tissue complications resulting from treatment . The model was also able to incorporate patient preferences for different health outcomes and complications, allowing for the calculation of quality-adjusted life expectancy for each treatment plan",model assumes that complications occur at the end of the 2nd year of the simulation and persist throughout the patient's lifetime; effects of complications are neglected for patients with metastatic cancer; odeling a clinical study from data presented in the literature has limitations; may not be directly generalizable to other cancer types or treatment modalities; not report specific testing or evaluation of user acceptance ,"ocus on refining the modeling of treatment-related complications to better capture the timing, severity, and impact of complications on patient outcomes; validating the decision-analytic model in diverse patient populations and treatment settings; explore the usability and acceptability; comparing the decision-analytic model with other decision support tools; explore the adaptation and extension of the decision-analytic model to other cancer types and treatment modalities",model incorporates patient preferences for different health outcomes and complications; ntegration of clinical and expert knowledge; multi-attribute decision theory to balance multiple objectives; Sophisticated ranking of treatment plans; Sophisticated ranking of treatment plans,,
1,1,"Julius Bishop, David Ring ",Management of Radial Nerve Palsy Associated With Humeral Shaft Fracture: A Decision Analysis Model,2009,Journal of Hand Surgery,USA,Scientific article ,to better understand the determinants of optimal management strategy for radial nerve palsy associated with a humerus fracture using expected-value decision analysis ,utility values derived from a questionnaire are incorporated into the algorithm to help guide the choice between observation and early surgery ,1,expected value decision analysis ,8,Radial nerve palsy associated with humerus shaft fracture,"preferences between early surgical intervention vs initial observation for radial nerve palsy  eg. Ratings with respect to best and worst possible result "" Your nerve recovers completely on its own within 6 to 12 months of the injury, without any treatment or surgery""",q,questionare completed by subjects without a history of humerus fracture and radial nerve palsy to determine utility values & by orthopedic residents ,"the utility values derived from the questionnaire were used in a decision tree analysis to evaluate the different management strategies "" Per convention, utility data were placed to the right of the terminal nodes, and probability data were placed under the terminal nodes""",d,d,"decision tree, fold back analysis to identify the optimal strategy  "" this involved multiplying each outcome utility by its associated probability, providing an ""expected value"" for each clinical end point. The expected values for each end point can then be summed for a given management strategy and the ultimate expected values of the different strategies compared.",q,questionnaire ,2,subjects ages ranged from 18 to 82 years without a history of arm fracture & orthopedic residents ,,Initial observation vs early surgical intervention for humerus fracture associated with nerve palsy,Rating preferences in questionnaire  , -Initial observation was the preferred strategy  - early surgery was preferable when the probability of recovery after observation was less than 40% or the utility value for successful early surgery was high  ,0,/,"Initial observation was the preferred strategy, however early surgery may optimise outcome in cases were likelihood of spontaneous recovery is low, or when the patient strongly prefers surgery ", -Utility is a subjective value which can be difficult to operationalize and quantify. In this study a likert scale was used which is less rigorous than the standard reference gamble  -individuals completing the questionnaires may not have had deep insight into the subtleties and implications of the various disease states and treatments ,to focus on methods of making an early distinction between nerves that will recover spontaneously and those that will not in this clinical scenario ,results of the study may help us to better understand the decision between initial observation and early surgical exploration ,,
1,1,Tervonen ET AL.,A stochastic multicriteria model for evidence-based decision making in drug benefit-risk analysis,2010,Statistics in Medicine,Nethderlands,research article,construct a stochastic multi-attribute model for the therapeutic group of antidepressants using data from a published placebo-controlled trial,explores the use of scenario-based ordinal preferences in the stochastic multicriteria model for drug benefit-risk analysis,1,model,6,depression,"Nausea, Anxiety, Efficacy, and Insomnia",l,literature,stochastic multi-attribute model,m,smcda,stochastic multi-attribute model,-, -,3,"health authorities, prescribing physicians, pharmacists, reimbursement policy makers, and employees of insurance companies, patients",,bar plots ranked by the accptability indices, -, -,0, -,"The main outcomes of the study are the trade-offs among the considered alternatives in terms of safety and efficacy. The study used a stochastic multicriteria model to analyze the benefits and risks of different drugs and their impact on patients&apos; health status. However, the authors caution that the results should be interpreted with care and that additional evidence from multiple studies should be taken into account for more comprehensive decision making.","relevant only with respect to the data within the trial and may not capture comprehensive benefit-risk profiles;preferences were elicited from a single expert, which might not represent the consensus among a larger group of experts; relative differences in safety and efficacy may not be large enough to significantly change a patient's health status"," evidence from all existing studies should be taken into account, rather than just a single trial. Future research should consider the model together with evidence synthesis methods, such as network meta-analysis, as it allows taking into account all evidence simultaneously;  model is relevant only with respect to the data within the trial, and for decisions depending on comprehensive BR profiles, it can serve only as a starting point for further discussion; preferences were elicited from a single expert, and might not represent consensus among a larger group of experts.","ability to include the sampling variation that is inherent in criteria measurements based on clinical trials, which allows for a more accurate assessment of how much different drugs differ on selected criteria; possibility to characterize typical trade-offs supporting a drug benefit-risk profile without knowing or eliciting the exact numerical preferences beforehand, which lowers the effort required to apply the modefferent situations and increases the tl in diransparency of the decision-making process",,
1,1,"Michelle Cunich, Kirsten Howard ",Integrating Evidence and Individual Preferences Using a Web-Based Multi-Criteria Decision Analytic Tool,2011,Patient ,Australia,Original Research Article ,"to introduce a new decision support tool, Annalisa (AL) for prostate cancer screening using MCDA template ",individual preferences are combined with clinical evidence to make an informed decision about prostate cancer screening,2,tool that calculates scoring based on weighted patient preferences and clinical evidence ,2,prostate cancer screening , -preferences on undergoing prostate-specific antigen testing  -preferences for benefits of prostate cancer screening as relative or absolute risk reduction,i,elicited in patient interviews by GP who used the tool  ,"tool uses a simple expected value algorithm to calculate scores for each option by considering the individual's preferences for different criteria as importance weights, and the evidence of the performance of each option on each criterion ",m,mcda,Annalisa (AL) web based decision support template uses MCDA,i, -interviews to elicit preferences,3,"GP, researchers, patients ",,whether an individual should undergo prostate-specific antigen (PSA) testing ,"quantified by GPs, where GPs adjusted the importance of different criteria by moving the sliders ",/,1,yes,introduction of AL that integrates patient preferences with evidence ," -low response rate from target GP sample  →full evaluation of ALProst would require a larger, representative sample of GPs -concerns that in real consultation GPs would be reluctant to adjust the evidence ratings to make ALProst more relevant to individual patients, primarily because of fears about being liable for doing so", -further evaluation of tool with a larger and more diverse group of healthcare providers, -structured and transparent method provided that incorporates patient preferences into medical decision making ,,
1,1,"J B Jones, Walter F Stewart",Shared decision making: using health information technology to integrate patient choice into primary care ,2011,TBM,USA,Research paper ,to evaluate a shared decision making process to manage risk of cardiovascular disease in primary care,patient preferences are incorporated into a computational model ,1,model,11,Cardiovascular Disease,treatment preferences to manage cardiovascular disease risk factors ,specific,Preference based Care Tool (PBCT),patients can select treatment options or combination of treatment options. An algorithm then evaluates each choice and calculates the net risk reduction benefit considering the patients risk profile  → then a menu is generated ranking all of the patients choices by the net risk reduction ,s,e,"HHQ, relative risk calculator & PBCT",tool,Patients used PBCT to choose their preferred options for managing cardiovascular disease risk faktors ,2,patients & physicians ,,"Medication, Nicotine replacement, dietary changes, Self-Change Counseling, to do nothing ",/,medication is most effective intervention but many patients prefer lifestyle changes ,1,yes,SMD integrated into primary care workflow,/,needs to be bettered and further assessed to be implemented in the real world ,better patient physician communication & better decision making regarding cardiovascular disease ,,
1,1,"Donna Rochon, Simon N. Whitney ",Elderly patients' experiences using adaptive conjoint analysis software as a decision aid for osteoarthritis of the knee,2012,Health Expectations ,USA,Research paper ,to obtain insight into the experiences of elderly patients using adaptive conjoint analysis software to explore treatment options for their knee osteoarthritis,model that was studied incorporates treatment preferences for managing knee osteoarthritis ,2,adaptive conjoint analysis software,15,Osteoarthritis of the knee,"various treatment attributes ( pills, creams, injections), frequency, associated risks, costs ",cj,adaptive conjoint analysis (ACA),"patients were asked to rank the desirability of various treatment attributes, and the adaptive conjoint analysis software used these rankings to present paired comparisons of treatment options to determine which attributes the patients valued most  -based on importance ranking ACA software predicts the most suitable treatment option for each individual ",m,cj,adaptive conjoint analysis,tool,defined their preferences on the computer ,2,"elderly patients, researchers",,"pills, cream, injection, exercise ",adaptive conjoint analysis software ranks the most important treatment attributes based on the preferences of the patients ,participants agreed with the predicted preferred treatment aboutu ⅔ of the times ,1,yes→ elderly patient's discussed their experience with the ACA software,insight into the experiences of elderly patients using the ACA-software was gained,limited computer literacy among elderly patients caused confusion,inclusion of more relevant treatment options,demonstrated potential of ACA to align treatment options with patient preferences,,
1,1,"Federer AE, Taylor DC, Mather RC 3rd",Using evidence-based algorithms to improve clinical decision making: the case of a first-time anterior shoulder dislocation,2013,Sports Medicine and Arthroscopy Review,USA,Research Article,To discuss the evolution of clinical decision making and introduce a decision model for treating first-time anterior shoulder dislocation,Their decision model includes patient preferences,1,Decision model,22,Orthopedic (specifically addressing anterior shoulder dislocation),Yes. About utility of each state,"l,e","Literature review, expert opinion (yet they only tested the developed model internally.)","Patients with a stable shoulder, achieved either through natural history or following primary arthroscopic stabilization, were assigned  a higher utility than those with an unstable shoulder while those having a stable shoulder achieved through revision  stabilization surgery have a score in between the these two. Also, they consider Disutility for Primary stabilization and Revision surgery by reducing WOSI score of patient for a duration of these treatments",s,u,For calculating utility they used Western Ontario Shoulder Instability Index (WOSI)  which is  a disease-specific quality of life measure  ,s,scoring,2,Yes,,Surgical Stabilizations Nonoperative Stabilizations,They used Markov Monte Carlo simulations to predict outcomes,The model enabled customized decision making which likely to improve satisfaction and adherence  ,0,No,"Improved decision making through a personalized approach, potentially leading to better patient outcomes and satisfaction", -,"further validation and refinement of decision models in clinical practice, exploration of patient outcomes",Tailored treatment decisions that potentially reduce recurrence and improve quality of life for patients with shoulder dislocation,,
1,1,"Matthew R. Baldwin, Peter B. Bach ",A Prognostic Model for 6-Month Mortality in Elderly Survivors of Critical Illness,2013,CHEST,USA,Original research,"to derive and validate a prediction model for 6-month mortality among elderly ICU survivors, hypothesizing that including markers of frailty and disability & preferences regarding resuscitation would be important in predicting the 6 month mortality ",patient preferences regarding resuscitation were incorporated in a model ,1,Prognostic Model ,24,elderly ICU survivors ,preferences regarding resuscitation were incorporated in the model ,-,not mentioned,DNR preferences were incorporated as part of a variable in the model to predict 6 month mortality ,s,s,"statistical analysis, prediction model was generated using logistic regression",-,not mentioned,2,healthcare providers & patients,,the outcomes of the model can be used to guide post discharge care decisions ,Independent percent contribution of predictor variables from the logistic regression model used to predict 6 month mortality in elderly,DNR preference accounted for the greatest amount of predictive power (27.9%),0,/,A model was developed that predicts the likelihood of 6-month mortality in elderly ICU survivors ," -model was derived and externally validated at two tertiary-care medical centers in New York City where utilization of acute care in the last 6 months of life is greater than at other major medical centers in the US  -principal diagnoses were retrospectively ascertained from International Classification of Diseases, clinical modification codes assigned by medical coders and these may not be as accurate as prospectively ascertained principal diagnoses ",model still needs to be validated in community hospitals and in other geographic regions where case mix and patients care may differ," -model derived from consecutively admitted elderly ICU patients, regardless of admission diagnosis, making the model potentially more generalizable to elderly ICU patients ",,
1,1,"Athale A, Giguere A, Barbara A, Krassova S, Iorio A",Developing a two-sided intervention to facilitate shared decision-making in haemophilia: decision boxes for clinicians and patient decision aids for patients,2014,Haemophilia,Canada,Research article,to create decision tools to inform and facilitate decision-making about treatment options in grey areas of haemophilia management,It describes steps to develop a desicition aid for Haemophilia ,3,"two tools were developed:  a decision  box for physicians, and a patient decision aid",3,Haemophilia,"yes, For 9 different topics",e,electronic Delphi questionnaire,Topics: 1- Beginning prophylaxis treatment in a previously untreated patient: timing and regimen 2- Beginning immunotolerance induction treatment in an inhibitor patient: timing and regimen 3- Choice of concentrate when starting treatment in a previously untreated patient,-,, -,r,Ranking important topics so they would know which topics whey should include in the aid,2,"yes, medical doctors",, -, -, -,1,"Yes , Positive","the results of this study showed that creating decision tools in a rare disease field such as haemophilia is feasible ,and positively received in clinical practice.",There were only limited data in this field to be used in the decision aid usability testing was limited in sample size,"1-To conducting a cluster, randomized trial to assess practical value and impact on clinical practice 2-to develop interactive online versions of the decision tools, where end-users will be able to personalize the content of the decision tools","the tools were unique in that  they are two-sided, and are meant to be used by both  the physician and patient",,
1,1,"Buffy Lloyd, Adela Grando",iDECIDE: A mobile Application for Insulin Dosing Using an Evidence Based Equation to Account for Patient Preferences,2015,Stud Health Technol Inform.,USA,Author manuscript ,"to develop iDECIDE which is an app that calculates insulin doses with incorporation of patient preferences ( exercise & alcohol intake), which is not done in standard insulin dosage calculations",patient preferences are incorporated in insulin dosages calculations,1,Insulin dosage calculations,5,Diabetes management (Insulin Dosage),"Intensity & duration of physical exercise, alcohol load & related carbohydrates from alcoholic beverages ",q,the users input these values in the app themselves ,the user inputs daily alcohol consumption & exercise the app themselves. iDECIDE calculates insulin dosage considering the patient's exercise plan & alcohol intake  → offers personalised treatment  ,d,e,Equation to calculate Insulin dosage ,tool,patients input daily alcohol consumption & exercise the app themselves ,2,Health care workers,,"different insulin dosage based on glycemic level, exercise & alcohol consumption",/,/,1,"feedback on iDECIDE from domain experiences in clinical decision support systems and usability, as well as fellow biomedical informatics graduate students","iDECIDE was developed, which is a mobile app prototype that personalises insulin dosage","iDECIDE does not communicate with continuous glucose monitors via wireless because gluucose reader manufacturer do not share the application programming interfaces that could facilitate such interactions  → manual input for glucose reading, alcohol.... is needed ",Further refinement of the system to account for differences in insulin pharmacokinetics  adopt user-centred design for iDECIDE ,individual needs and preferences from patients are being taken into consideration → empowers patients to manage diabetes ,,
1,1,Kuspinar et al.,Developing a Valuation Function for the Preference-Based Multiple Sclerosis Index: Comparison of Standard Gamble and Rating Scale,2016,Cognitive Science,Canada,Research Article,"contribute evidence towards the similarities and differences in the SG and the RS to reflect patient preferences, and to develop a multi-attribute utility function (MAUF) (i.e., scoring algorithm) for the PBMSI","develop a multi-attribute utility function (MAUF) (i.e., scoring algorithm) for the PBMSI",1,scoring algorithm,8,MS,"some of the specific items included in the Preference-Based Multiple Sclerosis Index (PBMSI) classification system, which reflect patient preferences",specific,SG and RS methods were utilized in the study to capture and quantify patient preferences for specific health states defined by the PBMSI classification system,MAUF integrates patient preferences obtained through the SG and RS methods into a comprehensive scoring algorithm that quantifies the value individuals with MS place on different health states,m,u,Preference weights; Multi-Attribute Utility Function ; ,w,directly involved in expressing their preferences for different health states using the Standard Gamble (SG) and Rating Scale (RS) methods and Weighting,2,Patients and Clinicians,, -,preference weighting,"By incorporating patient-derived weights, the researchers ensured that the MAUF accurately represented the preferences of individuals with MS in assessing health outcomes.",0, -,"By comparing these two approaches, the research sought to evaluate how patients valued different aspects of their health and well-being within the context of multiple sclerosis;  developing a scoring algorithm, known as the Multi-Attribute Utility Function (MAUF), for the Preference-Based Multiple Sclerosis Index;  development sample provided data to generate preference weights for the valuation of health states and develop the MAUF", -, -," approach allowed for a more nuanced understanding of how patients valued and prioritized various symptoms and functional limitations within the PBMSI;  RS method may offer practical advantages in eliciting patient preferences and capturing their perspectives on health-related quality of life;By incorporating patient preferences into the valuation function, the study aimed to provide a more patient-centered approach to assessing health outcomes and guiding clinical decision-making in MS; rsonalized approach to measuring health-related quality of life may enhance the relevance and applicability of the PBMSI in clinical practice and research",,
