recommendation,use,authors,title,year_publication,journal,country,study_design,aim,relation_to_research,typ_ds,type_of_dms,ICD,medical_condition,patient_preferences_incorp,assesment,assess_patient_preferences,description_patient_pref,type,type spec,tools_techniques_frameworks,involv,patient_involvement,,stakeholders_involved,a,design_reatement_options,evaluate_balance_quantify,findings_related_ebq,ua,user_acceptance_tested,outcomes,limitations,implications_future,benefits,
1,1,Chen et al.,"Development and usability testing of Understanding Stroke, a tailored life- sustaining treatment decision support tool for stroke surrogate decision makers",2020,BMC Palliative Care,USA,research article,aimed to develop a decision support tool for surrogate decision makers of stroke patients, developed a decision support tool for stroke surrogate decision makers that includes a values clarification exercise to help patients and their families make informed decisions about life-sustaining treatments,3,DSS,8,stroke,general,"i,specific","focus group, sorting","The tool was developed using multiple strategies, including input from a Patient and Family Advisory Council and focus groups consisting of healthcare professionals, stroke survivors, and family members. An ordinal prognostic model was developed for ischemic stroke and intracerebral hemorrhage using data from the Virtual International Stroke Trials Archive Plus and incorporated into the tool. Patient preferences were incorporated into the tool through a values clarification exercise, which helps surrogate decision makers determine what the patient would want in accordance with their values. The tool also offers the option to not see the prognosis to be mindful of family members&apos; preferences for information.",-,e,.,tool,"the tool was developed with a patient-centered approach, and a Patient and Family Advisory Council was formed to provide continuous input to the multidisciplinary team on the development of the tool. Additionally, focus groups consisting of nurses, therapists, social workers, physicians, stroke survivors, and family members reviewed key elements of the tool, including prognostic information, graphical displays, and values clarification exercise.",3,"Patient and Family Advisory Council, nurses, therapists, social workers, physicians, stroke survivors, and family members.",, -,,,0,,,,,,,
1,1,"Glen S Hazlewood, Nick Bansback ",Using a Discrete-Choice Experiment in a Decision Aid to Nudge Patients Towards Value-Concordant Treatment Choices in Rheumatoid Arthritis: A Proof-of-Concept Study ,2020,Dovepress ,Canada,Original research,to evaluate a decision aid that incorporates a discrete choice experiment to guide patients with early rheumtoid arthritis in making value-concordant treatment decisions ,decision aid presents customized treatment options based on the individual preferences ,2,presents treatment recommendation based on preferences,15,Rheumatoid Arthritis ,"importance of each treatment attribute (eg. risk, benefits, dosing)  → patients completed 6 tasks where they choose between 2 hypothetical treatments ",specific,discrete choice experiment (DCE) that involve hypothetical treatment scenarios , -patients choices in the discrete choice experiment were used to calculate the probability of choosing each treatment and based on that a recommendation is made  -tool utilizes a database of existing patient prefernces to map a given individual to a preference profile and then predicts whcih option would likely match their profile ,s,s,"discrete choice experiment, probabilistic modeling",tool,participate in the DCE & participate in pilot testing ,2,patients & physicians ,,"methotrexate alone or triple therapy (methotrexate, sulphasalazine, hydroxychloroquine)",analysis of the choices from the discrete choice experiment to predict treatment preferences,DA's prediction matched the actual choices made by patients in 72% of cases ,1,pilot testing ,"the DA is successful in guiding patients towards value-concordant treatment choices, with a good match between predicted and actual treatment choices "," -prior data from similar populations of patients are required to make individual-level predictions → limitation, particularly if the treatment landscape changed -number of patients in testings was small ","Uptake of decision aids and implementation studies, ideally tied to a broader suite of preference-sensitive decisions ", -improved decision-making (reduced decisional conflict),,
1,1,Wurmbach et al.,Development of an algorithm to detect and reduce complexity of drug treatment and its technical realisation,2020,BMC Medical Informatics and Decision Making,Germany,research article,develop an algorithm and computer-based app to detect and reduce the complexity of drug treatment," incorporates patient preferences by specifying complexity factors based on literature and expert rating, and then developing distinct key questions allocated to each complexity factor to guide conversation",3,algorithm,24,drug treatment,"52 complexity factors consist of  Swallowing difficulties, Diverse storage conditions, Complicated packaging, Patients' capabilities, Health literacy, Lifestyle considerations","l,e","model identifies complexity factors, develops key questions to assess patient preferences and needs, and provides optimization measures to address these preferences and needs","The algorithm was developed based on complexity factors selected from literature and expert rating, which were then integrated into an automated assessment. Key questions were formulated for each complexity factor to guide conversation with the patient and personalize the results of the assessment. Patient preferences were incorporated by considering their responses to these key questions and tailoring the suggested changes and trainings accordingly. Feasible suggestions to mitigate complexity were also provided, such as patient leaflets. The algorithm was technically realized as a tablet computer-based application and tested iteratively until no further technical or content-related errors occurred. Overall, the algorithm aims to comprehensively assess and reduce treatment complexity while considering patient preferences for maximum chance of acceptance.",-,e, -,q,"the patients&apos; perspective on the identified complexity factors was assessed interactively and stored in the tool. Key questions were allocated to all factors that could be automatically detected by the tool, and these questions were developed following a five-step process involving patients and healthcare professionals to ensure that they were specific to a complexity factor, comprehensible for patients, suitable to identify a patient&apos;s difficulties, and implementable in patient visits. For factors that could not be detected automatically, distinct questions were phrased to assess whether this factor was relevant for the patient. Therefore, patients were involved in the decision-making process through interactive assessment and the development of key questions.",2,"health care professionals, Patients",,"five algorithms suggesting alternative treatments, 44 patient leaflets, 27 training videos for inhaler devices, and 29 recommendations for action. The patient leaflets were developed based on already existing educational material, while the training videos were from the Deutsche Atemwegsliga e.V. for inhaler devices. The recommendations for action included suggestions for aids that facilitate medication administration, explanations of certain aspects of medication administration, and recommendations to review and consider changing the medication regimen.","The article mentions that 52 complexity factors were complemented with at least one key question for preference assessment and at least one optimization measure. These measures included 29 recommendations for action for the health care provider, 27 training videos, 44 patient leaflets, and 5 algorithms to select and suggest alternative drugs. However, it does not provide a detailed description of the methods used to evaluate, balance, or quantify patient preferences.","However, if you have a specific question related to the findings, please let me know and I will do my best to provide you with a concise answer.",0,no,successfully developed an algorithm for assessing and reducing the complexity of drug treatment; covers a wide range of different factors that potentially increase the complexity of drug treatment; dentified a total of 52 complexity factors; incorporated patient perspectives and preferences into the development of the tool,"Small Sample Size; study was conducted at a single center; identified and included a limited number of complexity factors;  incorporated patient preferences into the development of the tool, it did not explicitly assess the relative importance of different patient preferences r the trade-offs that patients may make between different preferences; did not assess the feasibility or effectiveness of implementing the tool in routine care; did not assess the long-term outcomes of using the tool",idate the tool in larger samples to assess its generalizability and reliability; identify and assess additional complexity factors that contribute to the complexity of drug treatment; assess patient preferences and trade-offs between different preferences; assess the feasibility and effectiveness; assess the long-term outcomes of using the tool; compare the tool developed in this study with other tools,"incorporated patient perspectives and preferences; validated the key questions; dentified and included a comprehensive set of complexity factors;  tool developed in the study allows for patient-specific selection of optimization measures; checked the feasibility of automated detection of complexity factors and specified rules and criteria for automated detection whenever possible; could be used in different settings, such as pharmacies, ambulatory care, and hospitals",,
1,1,Hermans et al.,"Hemophilia treatment in 2021: Choosing the""optimal"" treatment using an integrative, patient-oriented approach to shared decision-making between patients and clinicians",2021,Blood Reviews,Central Europe,Review,Development of practical algorithms for facilitating shared treatment decisions,Discussion of a complementary patient preference tool to help explore patients' treatment expectations and facilitate shared decision-making,2,Stand-alone tool,3,Hemophilia,"joint and muscle protection, adherence to treatment regimens, injection methods, mobility concerns, and the perceived benefits of different treatment options",e,Delphi-Method,"patient preference tool, which is designed to facilitate the selection of a treatment that aligns with the patient's expectations and priorities",e,e,rangking and weigting of treatment outcome scores,sur,fill in a survey,2,patients/family & clinicians,,re-weighted top three patient preference options,re-weighting treatment options by multidisciplinary team,Re-weighting removes patient preferential bias,0,no,"algorithm for clinicians and the patient preference tool are complementary, and it is hoped that they can be used together in shared decision-making","assigning relative weight to variables concerns subclinical features, still in the preliminary stages of development","fully developing and validating the proposed patient preference tool and overall approach to treatment decision-making, better understand the impact of a patient-oriented approach on treatment adherence, clinical outcomes, and quality of life,  explore the use of goal attainment scaling (GAS) in hemophilia treatment decision-making","improve adherence to treatment, help clinicians and patients overcome potential biases, help patients better understand and engage in the shared decision-making process",,
1,1,"Lazaridis C, Mansour A",To Decompress or Not? An Expected Utility Inspired Approach To Shared decision-making For Supratentorial Ischemic Stroke,2021,Neurocritical Care,USA,Research Article,"To explore insights from decision theory and propose an ""Expected utility"" inspired approach as a supplementary tool in the decision-making process.",It tries to propose a method to incorporate patient preferences for possible outcomes after each treatment. ,1,model,8,Patients with large territorial supratentorial infarctions,Ranking Utility of each possible outcome ,i,"directly eliciting or via surrogates, or based on previously expressed wishes",The expected utility is equal to the EU of all outcomes   for a particular intervention. It is derived by weighting  the utility of each possible outcome by its probability.,s,u,Expected Utility Theory,w,weighting,1,No,,decompressive craniectomy VS medical therapy ,Using scores in the modified Ranking Scale of expected utility calculation of hypothetical patient scenarios, -,0,No,"offering a ""formula"" for guiding decision-making based on ranking of outcomes  according to patient values, together with probabilistic information of alternative interventions associated with these outcomes",1-lack of detail in the modified Ranking Scale scale 2-feasibility of obtaining preference rankings during urgent goals-of-care meetings is questioned,1-the overall approach should be tested in a pilot study 2-Future research should explore rates of retrospective consent and pre-procedural outcome evaluations,"Results showed expectations and preferences of patients for after treatment, for example how independent they want to be, changes suitable treatment option for them. And this should be considered when making intervention decisions.",,
1,1,Kremer et al. ,Patient decision aid based on multi-criteria  decision analysis for disease-modifying drugs  for multiple sclerosis: prototype development,2021,BMC Medical Informatics and Decision Making,Netherlands,research article,develop a patient decision aid for disease-modifying drugs for multiple sclerosis based on multi-criteria decision analysis and to support shared decision making,"describes the development of a patient decision aid based on multi-criteria decision analysis, which incorporates patient preferences into the decision-making process ",2,patient decision aid,8,multiple sclerosis,"disease progression, quality of life, relapse rate, safety, and severity of side effects","s,i,l","surveys, interviews, literature.","Patient preferences were incorporated into the model through a weighting system. Patients were asked to rate the importance of each criterion on a scale of 0 to 100. These ratings were then used to assign weights to each criterion, reflecting the patient&apos;s individual preferences. The model then calculates a score for each DMD based on its performance on each criterion, weighted according to the patient&apos;s preferences.",m,mcda,"weighted-sum model, MCDA approach, trade-off",s,"value elicitation exercise, scale from 0 to 10 using sliders, select three to seven characteristics they wanted to include in their decision, patient&apos;s preferences were then used to rank treatment options using a weighted-sum model. The development team considered the cognitive burden for patients and the precision required when selecting the direct rating method for the value elicitation exercise.",3,"healthcare professionals (including MS neurologists and nurses), patient representatives from MS organizations, and an expert in patient decision aid development. Patients with prior experience with making a decision about disease-modifying drugs for MS were also involved in the development process.",,"all available treatment options for RRMS, including an explanation of the trade-off in treatment characteristics","direct rating and best-worst scaling, as well as the adaptation of the weighting method based on patient feedback.","yes, alpha test",1,iterative alpha pilot testing effectiveness of the patient decision aid.,"a systematic approach to developing the patient decision aid, assessing users; decisional needs, establishing a format, reviewing evidence, developing a prototype, and iteratively alpha testing the prototype. The approach also incorporates feedback from patients and healthcare professionals to improve the decision aid; the use of multi-criteria decision analysis allows for a comprehensive evaluation of the benefits and risks of different treatment options.","Limited testing; software ha technical limitations; generalizability to other medical decisions is unclear; complex and my be difficult to understand; resource-intensive due to systematic review, expert input and iterative testing",Beta testing; ramdomized controlled trial to test cost-effectiveness; explore generalizability; evaluate usability with lwo health literacy; incorporating patient feedback,"personalized to the patient's informational needs and preferences; ransparent information about the risks, benefits, and procedures involved in each treatment option; flexible and can be adapted to incorporate new evidence or changes; user-friendly and meets the needs of its intended audience due to iterative development; based on a systematic review of the evidence ",,
1,1,"Humphries B, León-García M, Bates S, Guyatt G, Eckman M, D'Souza R, Shehata N, Jack S, Alonso-Coello P, Xie F",Decision Analysis in SHared decision making for Thromboprophylaxis during Pregnancy (DASH-TOP): a sequential explanatory mixed methods pilot study protocol,2021,BMJ Open,Canada- spain ,Research Article,to describe the rationale and methodology of a pilot study that will explore the application of decision analysis to a shared decision-making process involving prophylactic LMWH for pregnant women or those considering pregnancy who have experienced a VTE,They described the method they will plan to use for elicitation and incorporation of patient prefrences,1,decision analysis,11,venous thromboembolism,"Yes, about preferred health states, ",specific,"First a direct choice exercise is conducted. Then three value elicitation exercises (rank ordering, visual analogue scale and standard gamble) is completed. ","The model is personalised according to women's age and risk of VTE and utilities(which is extracted from standard gamble test) for each health state. Based on this information, the decision analytical model will estimate the QALYs for each treatment option.",s,mar,Markov state transition model,w,weighting,1,No,,prophylactic LMWH no prophylactic LMWH,"After completing the direct choice, values elicitation exercises and receiving the results of their personalised decision analysis, women will be asked to make a preliminary treatment decision. Then the result of decision and women's choice will be compared to find conflicts.",As this paper was a protocol for pilot study there is no results or outcome,1,yes,As this paper was a protocol for pilot study there is no results or outcome,1-small sample size  2- recruitment of participants from two high-income countries,"After the pilot study success, a RCT should be conducted", -,,
1,1,Ankersmid et al.,Supporting Shared Decision-making About Surveillance After Breast Cancer With Personalized Recurrence Risk Calculations: Development of a Patient Decision Aid Using the International Patient Decision AIDS Standards Development Process in Combination With a Mixed Methods Design,2022,JMIR Cancer,Netherlands,research article,develop a patient decision aid using personalized recurrence risk calculations and the International Patient Decision AIDS Standards Development Process,"addresses the need for personalized information to support breast cancer patients in making decisions about posttreatment surveillance, which involves preference-sensitive decisions ",2,decision aid,2,breast cancer,general,i,interviews,"The algorithm used in the patient decision aid is the INFLUENCE-nomogram, which calculates personalized risks for cancer recurrence. Patient preferences were incorporated into the tool through a web-based deliberation tool that includes a patient-reported outcome measure on fear of cancer recurrence. The tool also includes a summary sheet that summarizes patient preferences and considerations. Overall, the patient decision aid aims to support shared decision-making by providing patients with personalized information about their risks and options for surveillance after breast cancer treatment.",d,e, -,,,2,"healthcare professionals, patients, and researchers",,, -,feasibility of integrating outcome data into the decision aid and the challenges of presenting data in a meaningful way. ,1,"yes, alpha testing; positive","the primary outcome of the study is patient-reported shared decision-making, while secondary outcomes include observed shared decision-making, decisional conflict and regret, fear of recurrence, risk perception, disease perception, and quality of life.",,"Regarding the implications for future research, the study suggests that further investigation is needed to determine the most effective ways to present outcome data to patients in a meaningful manner. Additionally, the authors note that it would be interesting to examine whether prescribing specified pathways in the patient decision aid based on personal risk or fear of cancer recurrence is effective. Finally, the study protocol outlines a randomized controlled trial to evaluate the effectiveness of the patient decision aid in improving shared decision-making and patient outcomes, which will provide further insights into the use of personalized risk calculations in post-cancer care.", -,,
1,1,Poehler et al.,The Development and Pilot Study of a Multiple Criteria Decision Analysis (MCDA) to Compare Patient and Provider Priorities around Amputation-Level Outcomes,2022,MDM Policy & Practice,USA,research article,pilot test the MCDA tool to determine its suitability in comparing patient and provider priorities around amputation-level outcomes,addresses the incorporation of patient preferences into medical decision-making through the use of the Multiple Criteria Decision Analysis ,1,model,11,chronic limb-threatening ischemia,"healing after surgery, ability to walk, preserving limb length, and ease of prosthetic or orthotic device use","s,specific,i","survey, AHP scale, interview","The study used a performance matrix to compare the outcomes of different amputation levels, and patients and providers were asked to rate the importance of each outcome. The ratings were then used to calculate the overall value of each amputation level, taking into account both patient and provider preferences.",m,mcda," -MCDA, AHP scale, Sheffield elicitation framework",tool,use of a shared decision-making context and the development of a patient-centered Multiple Criteria Decision Analysis ,2,patients and providers,, -,MCDA tool to evaluate and compare patient and provider preferences.,"the study developed an MCDA tool to compare patient and provider priorities around amputation-level outcomes. The pilot test of the tool showed that patients and providers had different priorities when it comes to amputation outcomes, highlighting the importance of shared decision-making in the amputation decision-making process. The study did not conduct uncertainty analyses.",1,"yes, pilot test",Identification of criteria important to patients and providers; Pilot testing of the MCDA tool; reliminary assessment of differences in patient and provider outcome priorities; Development of a patient-centered MCDA tool,"small sample size; sparse qualitative literature; More simplified suubquestions, modifing the wording and blinding level of amputation;",Lareger rollout; too modification with results from pilot testing; addressing Methodological Challenges (blinding alternatives); Investigate Generalizability; implement uncertainty analysis; ,successfullly developed and tested a new MCDA tool and identified criteria of patients,,
